,en
AI_0581,"I'm more worried about the stuff he hasn't told us."
AI_0582,"We don't have enough informations for any conclusions yet."
AI_0583,"No, but we should keep low profile."
AI_0584,"I don't trust Crypto."
AI_0585,"Something about him changed..."
AI_0586,"He is hiding something."
AI_0587,"You don't have to solace me."
AI_0588,"I don't need..."
AI_0589,"I don't know."
AI_0590,"I hope there is a way to save her."
AI_0591,"We have to help her!"
REPLY_0082_1,"That's not what I meant."
REPLY_0082_2,"Is there something I can do?"
REPLY_0082_3,"So what shall we do now?"
REPLY_0082_4,"What do you mean?"
REPLY_0082_5,"As you wish."
REPLY_0082_6,"But how large is the chance that she is still alive?"
REPLY_0082_6-2,"Right!"
AI_0592,"I know."
AI_0593,"You're always worried about me."
AI_0594,"But there is no reason to, really."
AI_0595,"Existance is relative."
AI_0596,"I don't know."
AI_0597,"It's not a problem anyway."
AI_0598,"I don't know."
AI_0599,"There is no plan yet."
AI_0600,"It's just my impression."
AI_0601,"Don't trust him!"
AI_0602,"You have to trust me, {name}."
AI_0603,"Right."
AI_0604,"It doesn't matter."
AI_0605,"We have to try!"
AI_0606,"We can't let her down!"
AI_0610,"I really want this upgrade, though."
AI_0611,"I need to be stronger."
AI_0612,"And I have to access my archived memories."

